source,sentence,paraphrase,result
paradetox,"if you think so , you are making a clown out of yourself .","If you think so, you are making yourself look unserious","If you think so , you are making a fool of yourself."
paradetox,impeachment of trump is a really dumb idea .,impeachment of trump is a really bad idea .,Impeachment of trump is not a good idea.
paradetox,implying americans are gonna vacation at that shit hole .,Implying Americans are going on vacation at slum,implying that americans are going to visit that place.
paradetox,in other news op is a fucking retard .,in other news op is not educated enough,in other news op is not so okay.
paradetox,"in other words , if you actually care about civil liberties and justice for all , republicans want you to fuck off .","In other words, if you really care about civil liberties and justice for all, Republicans want you to walk away.","In other words, if you care about civil liberties and justice for all, republicans want you to leave."
paradetox,"in the end , he was just a dick .","In the end, he was not good for me.","In the end, he was just not a nice person."
paradetox,"instead of trying to make a difference , ye old witch was more interested in making a statement .","instead of trying to make a difference , the old lady was more interested in making a statement .","Instead of trying to make a difference, she was more interested in making a statement."
paradetox,iran says that shit when its mail arrives late .,Iran says that word when its mail arrives late.,Iran says that when their mail arrives late.
paradetox,is there an option to upload a vid to youtube in shit quality so it uploads faster ? .,Is there an option to upload a video on youtube in low quality.,is there an option to upload a video to youtube in lower quality so it uploads faster ? .
paradetox,it 's just dumb fucking luck .,it 's just luck .,it's just bad luck.
paradetox,it s a big deal because the school didn t give a shit until she was being bullied .,it s a big deal because the school didn’t care until she was being bullied .,it's a big deal because the school didn't care until she was being bullied.
paradetox,it s about goddamned time .,it s about time .,It's about time.
paradetox,it s actually a great idea if you want to keep nuts out and get shit done .,it is actually a great deal if you want to get thing done,It's actually a great idea if you want to keep things organized and get things done.
paradetox,"it s like fucking jurassic park , but much fluffier ! .",It's like fluffy Jurassic park.,"it s like jurassic park , but much fluffier !"
paradetox,"it s not fucking the ukraine , just ukraine !",It is only Ukraine.,"It's not harming the Ukraine, just Ukraine!"
paradetox,it s refreshing to see someone who is so fucking smart and edgy .,it's refreshing to see someone who is so smart and edgy .,it s refreshing to see someone who is so smart and witty.
paradetox,it s the only thing keeping these species alive right now though over hunting has fucked many a species .,it s the only thing keeping these species alive right now though over hunting has destroyed many a species .,It's the only thing keeping these species alive right now though over hunting has impacted many species.
paradetox,it sucks that youre an awful person .,You are not a good person.,It's unfortunate that you're not a good person.
paradetox,it sure as fuck had nothing to do with anything i said .,it  had nothing to do with anything i said .,it certainly had nothing to do with anything i said.
paradetox,it tastes like shit and i 've never even seen it available outside of five - star restaurants .,It's doesn't taste really nice  but it's only available in five star restaurants,it tastes not good and I've never even seen it available outside of five-star restaurants.
paradetox,it was clear from the first fucking sentence of the article .,It was clear by the very first sentence of the article.,it was clear from the first sentence of the article.
paradetox,it would be fucked if that happened .,If that is happened it's not good,It would be bad if that happened.
paradetox,it would be fucking illegal as shit to straight up kill someone .,it would be illegal to kill someone,It would be illegal to straight up kill someone.
paradetox,its good that youre adding stuff but some of it is completely ridiculous .,its good that youre adding stuff but some of it is completely naïve.,Its good that you're adding stuff but some of it is not useful.
paradetox,its one of those you don t know what your saying so i m correcting you cunts .,It's one of those you don't know what your saying so I'm correcting you.,Its one of those you don't know what you're saying so I'm correcting you.
paradetox,"its time to void that stupid decision , my opinion , that property belongs to all alaskans not a select few , sorry .","Its time to let go of that wrong decision, my opinion, that propeety belongs to all Alaskans not a selected few, sorry.","It's time to void that decision, in my opinion, that property belongs to all Alaskans not a select few, sorry."
paradetox,jesus . i was having a nice sunday afternoon and then i read that shit ?,Jesus. I was having a nice Sunday afternoon and the I read that point?,Wow. I was having a nice sunday afternoon and then I read this?
paradetox,"jesus christ , that 's incredibly fucked up .",jesus christ . that's incredibly bad,"Jesus Christ, that's incredibly bad."
paradetox,"jesus christ , what a fucking crock of shit .","jesus christ , this is nonsense","Jesus Christ, what a mess."
paradetox,"joke 's on you , you intolerant fuck .",Joke's on you,Joke's on you.
paradetox,"judging by the shit i ve seen in my number years , number of those spent with george w .","Judging by the wrong things I've seen in my number years, number of those spent with George w.","Judging by the things I've seen in my years, a number of those spent with George W."
paradetox,"just a thought , but maybe stay the fuck away from the chinese .",People think that they should be awy from Chinese,"Just a thought, but maybe stay away from the Chinese."
paradetox,"just cut to the chase and try to contact my provider , asshole !",Cut to the chase and contact my provider,just try to contact my provider directly.
paradetox,just state your fucking opinion .,Just state your opinion please,just state your opinion.
paradetox,just the shit they get are worth hundreds of thousands if not millions of dollars .,just the things they get are worth hundreds of thousands if not millions of dollars .,just the things they get are worth hundreds of thousands if not millions of dollars .
paradetox,keep your filthy paws off wikipedias articles unless you have something worthwhile to contribute .,keep your hands off wikipedia's articles unless you have something worthwhile to contribute.,Keep your hands off Wikipedia's articles unless you have something worthwhile to contribute.
paradetox,"kid , you should be watching the crap they call cartoons now made for your generation .","Kid, you should be watching what they call cartoons now made for your generation.",You should be watching the cartoons made for your generation.
paradetox,"last warning you fucking tosser , it takes meminutes to resolve a page so cunts like you can fuck wikipedia up","Last warning for you, it takes me minutes to resolve a page so you can take help of Wikipedia","last warning, it takes meminutes to resolve a page so people like you can mess up wikipedia."
paradetox,last winter was fucking brutal .,Last winter was bad,last winter was very harsh.
paradetox,legacy of being a selfish shit head .,Legacy of being a selfish person,Legacy of being selfish.
paradetox,let 's have them do all the tough shit men are forced to do .,Let's have them do what other men do,Let's have them do all the difficult tasks men are required to do.
paradetox,let darwinism take its course so that the least stupid shall inherit the earth .,let darwinism take its course so that the least shall inherit the earth.,Let natural selection take its course so that the most capable shall inherit the earth.
paradetox,lgbt whine and bitch all the way to the courts to have the twice declined decision overturned .,lgbt whine all the way to the courts to have the twice declined decision overturned .,LGBT people take their case to the courts to have the twice declined decision overturned.
paradetox,"liar , liar pants on fire justin .",Constantly lying Justin,Justin is not telling the truth.
paradetox,"like , who gives a shit what trump s view on this is haha ? .","like , who cares what trump's view on this is haha?","Like, who cares what Trump's view on this is haha?"
paradetox,"lol , sunshine was critically acclaimed you moron , lol .",Sunshine was critically acclaimed,"Lol, sunshine was critically acclaimed you, haha."
paradetox,"lol , yeah , like that would ever fucking happen .",It will not happen again,"Lol , yeah , like that would ever happen."
paradetox,"lol , yes but the spending was due to the idiotic wars your hero , g w bush waged .","lol , yes but the spending was due to the wars your hero , g w bush waged .","lol, yes but the spending was due to the wars your hero, G W Bush waged."
paradetox,lol i remember glenn beck and a fuck ton of other americans using the tragedy for attention .,Lol i remember Glenn beck and a ton of other americans using the tragedy for attention,i remember glenn beck and a lot of other americans using the tragedy for attention .
paradetox,look the shit up yourself .,Look for yourself.,Look it up yourself.
paradetox,looks like the not fucking around crew is making decisions now .,looks like the good crew is making decisions now .,looks like the serious crew is making decisions now.
paradetox,"looks like you were just a teeny fucking bit off the mark there , friend .","Looks like you were just a bit off the mark there ,friend","looks like you were just a bit off the mark there, friend."
paradetox,"lucky you , maybe now you think youre somebody , huh , fool ?",I don't care who is to think about to me you know I am lucky.,"You're lucky, maybe now you think you're somebody, huh?"
paradetox,make a fucking guess how somebody can misspell area as aera then .,"Guess , How somebody can misspell area",make a guess how somebody can misspell area as aera then.
paradetox,making and distributing cp is fucked .,Making and distributing cp is not good,Making and distributing cp is wrong.
paradetox,man you are so insecure about your dick .,"man, you are so insecure about your genital organ.","Man, you are so insecure about your situation."
paradetox,maybe i go peacefully so i can kill thousands later in righteous vengeance when shit gets settled in court .,"Maybe I'll go peacefully so that later, when things are settled in court, I can show thousands of people that I'm right.",Maybe I go peacefully so I can seek justice in court later.
paradetox,"maybe not always relevant , but they sure are fun you fuckin dipshit !","maybe not always relevant , but they sure are fun you","maybe not always relevant, but they sure are fun you silly person!"
paradetox,maybe now no one will be rammed in the ass .,May be now no one will be messed up,maybe now no one will be taken advantage of.
paradetox,military can be very stupid too .,Military can make a mistake.,Military can be very wrong too.
paradetox,minorities bitch and moan when the police uphold the law .,"When the police uphold the law, someone will complain.",Minorities complain when the police enforce the law.
paradetox,monarchists and incredibly arrogant and selfish .,royalists and incredibly presumptuous and individualistic.,Monarchists are incredibly arrogant and selfish.
paradetox,most likely he gave her a couple of pats on the butt and shes over dramatizing the whole thing .,He most likely gave her a couple of pats on the buttocks and she's exaggerating the situation.,most likely he gave her a couple of compliments and she's over exaggerating the whole thing.
paradetox,most of the information is total garbage .,most of the information is total waste,Most of the information is not useful.
paradetox,"munozs letter implicates the whole board of directors as feckless goofs , tolerating a selfregarding moron as their lead employee .","munozs letter implicates the whole board of directors as feckless people, rolerating a self regarding candidate as their lead employee","Munoz's letter implies that the whole board of directors are not doing their job properly, tolerating a self-regarding person as their lead employee."
paradetox,my comment was more a diatribe about how there should be more outrage at home for this shit .,My comment was more a ranting about how there should be more outrage at home for these things,my comment was more a diatribe about how there should be more outrage at home for this.
paradetox,my thoughts are that our new guy might be an even bigger dirt bag .,We should be careful selecting a new person.,my thoughts are that our new guy might be an even worse person.
paradetox,my wife still gives me shit for it .,My wife still fights with me for it.,my wife still scolds me for it.
paradetox,never heard such a poorly written crock of pure bullshit !,I've never seen such bad written article!,Never heard such a poorly written nonsense.
paradetox,never trust anything the repugs try to shove down your throat .,Never trust anything you're forcefully told,Never trust anything the repugs try to push.
paradetox,"no , i m pointing out that you are being a condescending ass about it , just like your euphoric brethren .","no , i m pointing out that you are being a condescending about it , just like your brethren","No, I'm pointing out that you are being a disrespectful about it, just like your peers."
paradetox,"no , putin will send depardieu to fuck harper 's wife .","no , putin will send depardieu to deal with harper 's wife","No, putin will send depardieu to confront harper's wife."
paradetox,"no , racism is a lot older than the fucking newspaper .",Racism is older than newspaper,"No, racism is much older than the newspaper."
paradetox,"no , that s fucking bullshit .","Nope, that doesn't make sense.","No, that's not true."
paradetox,no . almost nobody is saying that except for those fucking idiots in the video .,No. almost nobody is saying that except those in video,No. Almost nobody is saying that except for those people in the video.
paradetox,"no fucking way number bricks fits in a car , this is bs .","the bricks are too many, they cant fit in the car","No way number bricks fits in a car, this is unbelievable."
paradetox,"no i didnt what year did you move here , ignorant ? .",No I didn't what year did you came here?,"No, I didn't. What year did you move here?"
paradetox,no one being investigated for treason ignorant brain washed fool,no one being investigated for treason,no one is being investigated for treason.
paradetox,no self - respecting australian or new zealand would read such hateful shit .,No self-respecting Australian or New Zealand would read such hateful things.,no respectable australian or new zealand would read such hateful thing.
paradetox,"no shit , lockheed or raytheon or boeing or you name it employs half his districts employees .","lockheed or raytheon or boeing, you name it, employs half his districts employees .","It is not surprising that Lockheed, Raytheon, Boeing, or other companies employ half of his district's employees."
paradetox,no shit this has already been done .,"No way, this has already been done.",No surprise this has already been done .
paradetox,no you doofy fuck that is a bolt action ! .,No it is a bad action.,"No, you doofy, that is a bolt action!"
paradetox,"nobody in politics , especially democrats , give a shit about citizens , let alone the military .","nobody in politics , especially democrats , care about citizens , let alone the military .","Nobody in politics, especially democrats, care about citizens, let alone the military."
paradetox,none of that would ever have happened if he werent black .,that happened because we were black.,None of that would have happened if he wasn't a person of color.
paradetox,noones asking you to invade shit .,No one is asking you to invade anything.,no one is asking you to invade anything.
paradetox,"not even from brainless , hypocritical marxist pigs .",not even from marxist people.,not even from hypocritical marxist people.
paradetox,not fucking around in foreign matters that we cannot do anything about .,I do not interfere with matters that are out of my hands,Not meddling in foreign matters that we cannot do anything about.
paradetox,not hard seeing as how their prime minister is a shit head .,it's not hard to see how hard your prime minister is,Not hard seeing as how their prime minister is not good.
paradetox,"not just a biologist , a fucking virologist ! .","not just a biologist , a bad virologist ! .","not just a biologist , a virologist ! ."
paradetox,"not the rich and the government , but the people will be in shit street .","not the rich and the government , but the people will be in bad street.","Not the rich and the government, but the people will be in a difficult situation."
paradetox,not to be confused with the legal firm bull shit associates .,not to be confused with the legal firm associates.,not to be confused with the legal firm associates.
paradetox,"not trying to be a dick , just joking .",No trying to be rude .am just joking,"Not trying to be mean, just joking."
paradetox,nothing but missing footage is sure going to make whatever happened during that unaccounted for time look shady as fuck .,Only the missing footage will show what happened during the unaccounted time,nothing but missing footage is sure going to make whatever happened during that unaccounted for time look suspicious.
paradetox,"now congress , congress don t do shit .","now congress , congress does nothing.","now congress, congress doesn't do anything."
paradetox,"now quit fucking up education in texas , rick !",Now quit education in texas,"Now stop disrupting education in Texas, Rick!"
paradetox,now shut up and fix it .,now fix it,now be quiet and fix it.
paradetox,now that is just a fucking dumb thing to say .,now that is just a useless thing to say.,now that is just an unhelpful thing to say.
paradetox,number will solve alot of fucking problems if it comes down to it .,the solution is the number,number will solve alot of problems if it comes down to it .
paradetox,"oh , i m hearing shit like that from her too .",i've heard same things from her also,"oh , i m hearing things like that from her too ."
paradetox,"oh shit , what if north korea actually is funding isis ? .",is north korea funding Isis?,"oh no , what if north korea is actually funding isis ?"
paradetox,oh shit you just blew their minds .,Oh you just blew their minds,oh wow you just blew their minds.
paradetox,one isn t dead but just totally fucked up .,One is not dead but just completely destroyed,One isn't dead but just totally messed up.
paradetox,only boneheads would buy into this stuff from the msm .,Prople with no information will buy into this stuff from msm,Only people who are not informed would buy into this stuff from the mainstream media.
paradetox,only if they have a fucking death wish .,only if they have a death wish,Only if they are willing to take the risk.
paradetox,only the dumbest people voted for him .,Only the misinformed people voted for him.,Only the uninformed people voted for him.
paradetox,or are you pulling this out of your ass ? .,Are you making things up out of thin air?,Or are you pulling this out?
paradetox,or just go with this cunt en .,U can go with her,or just go with this person.
paradetox,org read a fucking book for fuck s sake .,Read a book for your own good,Org read a book for christ sake.
paradetox,org there s wikipedia articles for all sorts of random shit like this .,Org there s wikipedia articles for all sirts of random things like this .,org there's wikipedia articles for all sorts of random topics like this.
paradetox,"org yeah , muslims in the western world love to decry this shit .","org yeah , muslims in the western world love to decry this","Additionally, Muslims in the Western world often criticize this."
paradetox,"ouch man , them swedes were dicks to norway =\",The Swedes were bad to Norway,"Ouch man, them swedes were unkind to norway."
paradetox,ours is pretty fucked up too .,Ours is pretty messed up too,ours is pretty messed up too.
paradetox,p. s. i do own all of those pictures bitch .,"Please, i own all those pictures.",P.S. I do own all of those pictures.
paradetox,parliament is a lame duck .,Parliament is unsuitable,Parliament is ineffective.
paradetox,pathetic with all the money alaska has collected through oil taxes your representatives want to tax you .,With all the money alaska has collected through oil taxes your representatives want to tax you,"It's unfortunate that with all the money Alaska has collected through oil taxes, your representatives want to tax you."
paradetox,people are idiots for wasting emergency call time on crap like this .,People are unreasonable for wasting emergency call time on things like these.,People are irresponsible for wasting emergency call time on things like this.
paradetox,people don t even wash their damn hands after taking a shit .,people don't wash their hands after using the toilet.,people don t even wash their hands after using the restroom.
paradetox,people saying things like these people are monsters and how can these people get away with this shit .,"people saying things like these people are monsters, it's sad that nobody can sue them",People saying things like these people are bad and how can these people get away with this behavior.
paradetox,"perhaps iran would be nicer if we didn t , you know , treat them like shit for the past number years .","perhaps iran would be nicer if we didn t , you know , treat them poorly for the past number years .","perhaps Iran would be nicer if we didn't, you know, treat them badly for the past few years."
paradetox,"piss me off , fuckin jerk , get on my nerves .",You annoy me,"Annoy me, get on my nerves."
paradetox,planet earth is fucking crazy .,Planet earth is crazy,Planet Earth is crazy.
paradetox,please just stay the hell off and erase me from your brain like a chalkboard erasure and dont come back !,Please don't contact me again,Please just stay away and erase me from your memory and don't come back!
paradetox,"price wise , it 's fucking awful .",It’s price is so high.,"Price wise , it 's terrible ."
paradetox,probably shit tons of terrible things .,probably does tons of terrible things,Probably lots of terrible things.
paradetox,probably some of them are actuated by nothing worse than stupidity .,Probably some of them are actuated by nothing good,Probably some of them are actuated by nothing worse than wrongness.
paradetox,put their asses in angola .,Put then in angola.,Put them in Angola.
paradetox,quit trying to pretend that the us is anything like this backwards shit hole .,Quit trying to pretend.,Quit trying to pretend that the us is anything like this place.
paradetox,"quite a few saints are canonized because they opposed some idiot hierarch , even unto being killed , like st .","many saints are canonized because they opposed some troubled hierarch, even being killed, like st.","quite a few saints are canonized because they opposed some authority figure, even unto being killed, like St."
paradetox,randy johnson is a troll .,Randy Johnson leaves mean comments in social media platforms.,Randy Johnson is a bully.
paradetox,read your own fucking link .,Please read your own link.,Read your own link.
paradetox,reducing early voting from number down to number days sure is shitting all over the citizens of the united states .,reducing early voting from number down to number days is what is norm all over the citizens of the united states.,Reducing early voting from a certain number of days sure is disadvantaging the citizens of the United States.
paradetox,removed from reality in - fucking - deed,Removed from reality in deed,removed from reality indeed
paradetox,republicans and democrats are the right and left cheeks of the same ass .,Republicans and democrats are same minded,Republicans and Democrats are two sides of the same coin.
paradetox,"right , that 's what i was implying by saying the un won 't do shit , because russia is on the sc .",Russia is on the sc right that what i was implying,"right, that's what I was implying by saying the un won't do anything, because Russia is on the sc."
paradetox,"same as his stupid wall , and the dumb solar panel idea , and countless other idiotic things hes done .","the same as his unnecessary wall, and the wrong idea of ​​the solar panel, and countless other things he shouldn't have done","Same as his wall, and the solar panel idea, and countless other things he's done."
paradetox,same crap going on in the pnw too .,same thing going on in the pnw too.,Same stuff going on in the PNW too.
paradetox,selective censorship and non reporting of factual and correct statements he makes of other leaders idiotic decisions !,selective censorship and non reporting of factual and correct statements he makes of other leader’s decisions!,Selective censorship and non reporting of factual and correct statements he makes of other leaders bad decisions!
paradetox,"sell your ships , find a new job , get the fuck out of the number th century , thanks .","sell your ships , find a new job , get out of the number th century , thanks .","Sell your ships, find a new job, leave the 21st century, thanks."
