source,sentence,paraphrase,result
paradetox," mandated  and "" right fucking now "" would be good .","Mandated' and right now"" would be good.","mandated  and ""right now"" would be good."
paradetox,* neither * of my coworkers gave a shit when it came time to ditch mitch . ugh .,Neither of my co-workers cared when it came to ditching Mitch.,Neither of my coworkers cared when it came time to ditch mitch. Ugh.
paradetox,"* well shit , cunt shot himself .","*well, he shot himself.","Well, he shot himself."
paradetox,&gt i wouldn 't care how ignorant you are in you weren 't pretending to know shit .,I wouldn't care how you weren't pretending to know things.,I wouldn't care how uninformed you are if you weren't pretending to know about it.
paradetox,&gt today was one of the most fucked up days of my life .,Today was one of the bad days of my life.,&gt today was one of the most difficult days of my life .
paradetox,"<number> , people will freak the fuck out .",people will freak  out,"<number>, people will be surprised."
paradetox,3 . you don 't fuck with a mommas boy,you don 't joke with a mommas boy,3. you don't mess with a mommas boy
paradetox,6. are you fucking insane ?,Are you insane?,6. Are you insane?
paradetox,"abortion is not a fundamental right it is a proceedure , nothing more idiot",Abortion is not a fundamental right it is a procedure,"Abortion is not a fundamental right, it is a procedure, nothing more."
paradetox,"actually no , i hate looking for shit .","No,I cannot see.","Actually no, I don't like looking for things."
paradetox,after all its hard to get a job if your stupid .,After all it’s hard to get a job if you're not smart,after all its hard to get a job if your not intelligent.
paradetox,after all most of these dorks are millionares and can pay their own way .,After all most of these are millonares and can pay their own way.,"After all, most of these people are millionaires and can pay their own way."
paradetox,"again , give me the name of the store or fuck off , liar .",Just Give me the name of the store without lying,"again, give me the name of the store or leave, liar."
paradetox,"ah , another supporter for those who hate people of color and those of the jewish faith .",Another person who is racist.,"Ah, another supporter for those who dislike people of color and those of the Jewish faith."
paradetox,all i got from that was shits gonna go down and nobody is going to be ready .,"All I got from that was, what will be will be and nobody will be ready for it",All I got from that was things are going to get difficult and nobody is going to be ready.
paradetox,"all that garbage you see on tv is just that , garbage .",There is nothing good on t.v.,all that you see on tv is just not good.
paradetox,"all that said , why would any woman vote for this cretin ?",all that said why would any woman vote for him,"All that said, why would any woman vote for this person?"
paradetox,all you trump clowns are seriously messed up .,Trump followers are not right on this matter.,All you Trump supporters are seriously misguided.
paradetox,allowing whole colonies of such rubbish to arise should be punishable by firing the officials .,allowing whole colonies of that nature to arise should be punishable by firing the officials,Allowing whole colonies of such people to arise should be punishable by firing the officials.
paradetox,almost as fucked up as the cia funding and arming bin laden .,Almost as dangerous as funding and arming bin laden,almost as bad as the cia funding and arming bin laden .
paradetox,almost feels like we need vigilantes to show the rubbish people their limits .,We need to show some people what their limits are.,almost feels like we need to show the wrong people their limits .
paradetox,"also , the us doesn 't really have to give a shit about international laws .","Also, the us doesn't care about international laws","also , the us doesn 't really have to care about international laws ."
paradetox,"also , why the fuck is tepco anywhere near this ? .","also , why is tepco anywhere near this ?","Also, why is tepco anywhere near this?"
paradetox,also known as fuck the middle east part number .,Also known as Middle East part number,Also known as the middle east part number.
paradetox,america would go the same route but that shit doesn 't fly here .,América can handle this situation in right way but this problem will be remained here.,America would go the same route but that kind of thing doesn't work here.
paradetox,americans don t give a shit what britons think .,Americans don't care for what Britons think,Americans don't care what Britons think.
paradetox,"amy , your ignorance is showing again .","amy , your lack of understanding is showing again","Amy, you are not well informed."
paradetox,anarchy is basically a philosophy for dumb teenagers and marxism is about dead .,"Marxism is about the dead, and anarchy is basically a philosophy for ignorant kids.",Anarchy is not a good philosophy and Marxism is outdated.
paradetox,"and because the government need this land , fuck people who live there , right ? .","and because the government need this land, the people who live there don't matter, right?","And because the government need this land, people who live there are disregarded?"
paradetox,and dumdums actually throw money at these clowns ?,Someone gives money on them?,and people actually throw money at these people ?
paradetox,and i can t forgive democrats for being rich cunts thinking they are the better rich .,And I can't forgive Democrats for being rich thinking they are better rich,and I cannot forgive democrats for being wealthy and thinking they are superior.
paradetox,and nobody gave a shit .,Nobody didnt care.,And nobody cared.
paradetox,and some people fucking buy that .,And some people buy it.,and some people buy that.
paradetox,and start sending cunts home .,and starts sending girls home.,and start sending people home.
paradetox,and telling nato to fuck off .,and telling nato to leave.,and telling nato to go away.
paradetox,and they are too ignorant to realize it .,And they are too inosent to realize it.,and they are too unaware to realize it .
paradetox,and they really dont give a crap what we think or of our sanctimonious moralizing .,and they really dont care about what we think or of our sanctimonious moralizing .,And they really don't care what we think or of our moralizing.
paradetox,and why the fuck did the manager tell the cop that ?,Why did the manager said like this to cop?,And why did the manager tell the cop that ?
paradetox,and ya can 't draw fucking cartoons .,I can't draw cartoon,and ya can 't draw cartoons .
paradetox,"anddddd i applied there , so my social security number has probably been stolen as well . fuck .","and i applied there, so my social security number has probably been stolen as well.","and I applied there, so my social security number may have been taken too."
paradetox,another piece of useless manufactured junk !,another piece of manufactured stuff !,another piece of manufactured junk !
paradetox,any fool can borrow and spend .,Anyone can borrow and spend,Anyone can borrow and spend.
paradetox,any of us who did half this shit would be locked the fuck up already .,Any of us who did this sort of thing would be locked up already.,any of us who did half this would be locked up already.
paradetox,"anyone can edit it , it is very retarded .","anyone can edit it , it is very simple .","anyone can edit it, it is not ideal."
paradetox,anyone is better than this dummy .,Anyone is better than him.,Anyone is better than this person.
paradetox,anyone who votes in communism is really really dumb and out of touch with reality .,The one who votes in communism is a people who don't have knowledge,Anyone who votes in communism is not in touch with reality.
paradetox,apologies i said fuck you multiple times and called you an asshole and other dumb names .,Apologies i said bad words to you,apologies i said inappropriate words multiple times and called you an inappropriate name.
paradetox,are they liars or just clueless ?,Are they liars or unaware?,Are they dishonest or just unaware?
paradetox,as a member of the lafayette community why the fuck does it matter what his political standing is !,"As a member of the Lafayette community,why should we care about his political standing?","As a member of the Lafayette community, why does it matter what his political standing is?"
paradetox,as he would say what a pathetic loser .,as he would say what a naive person,as he would say what a unfortunate person.
paradetox,"as ive said a thousand goddamn times , the translatitens voyage uses spitzbergen , with a fucking z !","as I have said a thousand times, the translation voyage uses Spitzbergen, with a z","As I've said a thousand times, the Translatitens voyage uses Spitzbergen, with a z!"
paradetox,"as ive said a thousand goddamn times , thetranslatitens voyage uses spitzbergen , with a fucking z !","as I have said a thousand times, the translation voyage uses Spitzbergen, with a z","As I've said a thousand times, the Translatitens voyage uses Spitzbergen, with a z!"
paradetox,"as someone from la and an oilfield worker , i still say this guy is a piece of shit .",as someone from la and an oilfield worker,"As someone from LA and an oilfield worker, I still say this guy is not good."
paradetox,assad leaves and it will be a total shit show in syria .,Assad leaves and Syria will be in a mess.,Assad leaves and it will be a total mess in Syria.
paradetox,assad must be shitting his pants in fear .,Assad is in fear.,Assad must be scared.
paradetox,at least one party gives a crap about humans after birth .,at least one party cares,At least one party cares about humans after birth.
paradetox,at the same time as your fucking article .,At the same time as your article,at the same time as your article .
paradetox,"attacking him , calling him names , making up garbage about him .","Attacking him, calling him names, accusing him falsely.","Criticizing him, calling him names, making up false information about him."
paradetox,because israeli rabbis never say fucked up shit .,Because Israeli rabbis don’t tell lies,because Israeli rabbis never say inappropriate things.
paradetox,because its fucking reposted so much .,It had been to much reposted,because it's reposted so much.
paradetox,because you are a hypocrite .,Because you are being dishonest.,Because you are inconsistent.
paradetox,because you re making that nazi shit up .,Because what you are saying about the Nazi is not true.,Because you are fabricating that information.
paradetox,"better to keep your mouth shut and be thought a fool , than open it and be proven one .",better to keep your mouth shut and be considered neutral than to open it and talk nonsense,"It is better to keep your mouth shut and be thought of as unwise, than open it and be proven one."
paradetox,blame the parents who bitch and moaned for all the child protection bullshit in schools these days .,Blame the parents for all the child protection in schools these days .,blame the parents who complained for all the child protection regulations in schools these days.
paradetox,bloated crap that comes out of these other .,Bloated stuff that comes out of these other.,bloated material that comes out of these other.
paradetox,boeing is behaving exactly like any greedy bully would .,boeing is not a good behaviour,Boeing is behaving like a greedy bully.
paradetox,but mostly that middle of the street shit .,but mostly issues of middle of the street,but mostly that middle of the street stuff.
paradetox,"but nobody knows what the fuck kennedy will do , so they re all strategically sitting tight .","but nobody knows what kennedy will do , so they re all strategically sitting tight .","but nobody knows what Kennedy will do, so they are all strategically sitting tight."
paradetox,but redditors are too busy sucking bernie s dick to care .,but redditors are too busy to care .,but redditors are too busy supporting Bernie to care.
paradetox,but ukraine is unwilling to buy a fucking gas .,But Ukraine is unwilling it buy gas,but ukraine is unwilling to purchase a gas .
paradetox,"by the way , sorry about that stupid edit .","By the way, sorry about the wrong edit.","by the way , sorry about that edit ."
paradetox,"california s last primary election was a fucking farce , doofus .",California's last primary election was a farce.,"California's last primary election was a mess, doofus."
paradetox,call me on my stupidity ?,Call me on my shortcomings?,Point out my mistakes?
paradetox,"call me stupid , but it seems the page was not moved so much as copied .","call me illogical, but it seema the page was not moved so much as copied.","call me naive, but it seems the page was not moved so much as copied."
paradetox,"calm the fuck down , cnn .",Calm down,"Calm down, CNN."
paradetox,can someone explain this shit please .,can someone  explain this,Can someone explain this please.
paradetox,can t people just leave cuba alone so it can get it s feet under itself for number fuckin minutes ? .,Can't people leave Cuba alone so it can get it's feet under itself for some minutes,Can't people just leave cuba alone so it can get its feet under itself for a few minutes?
paradetox,can we just keep dog shit out of this ? .,Can we just keep it out of this?,Can we just keep this away from this?
paradetox,cant you lazy bums do anything ?,You are very lazy,Can't you do anything?
paradetox,"careful , you just described the goonies , and that shit was classic .","careful , you just described the goonies , and they were a classic.","careful, you just described the Goonies, and that was classic."
paradetox,china and russia will use a big stick to smack trump around if those ships do anything foolish .,china and russia will use a big stick to smack trump around if those ships do anything unwanted,China and Russia will use a strong approach to reprimand Trump if those ships do anything foolish.
paradetox,colin kaepernick is an idiot .,I don't agree with Colin kaepernick,Colin Kaepernick is not wise.
paradetox,"collins , is an idiot , but we didnt need this article to establish that fact .","collins is clueless, but we didnt need this article to establish that fact.","Collins is not smart, but we didn't need this article to establish that fact."
paradetox,"come on , adn , are you really that hard up that you have to publish this dreck ?","come on , adn , are you really that hard up that you have to publish this ?","Come on, ADN, do you really need to publish this?"
paradetox,come on ya fuckin dummy get your right step right .,"can you please get your steps, right?","Come on, get your step right."
paradetox,corrupt kirky boy needs to get fired !,He will be fired.,Kirky needs to be dismissed!
paradetox,"could ve fooled me , all governments are corrupt as fuck .","Could have fooled me, all government are corrupt.","Could have fooled me , all governments are corrupt."
paradetox,cretins like this rarely care about facts .,people like this rarely care about facts,People like this rarely care about facts.
paradetox,"crimea voted for secession and russia accepted and annexed crimea , what fucking crisis ! ! ! !",crimea voted for secession and russia accepted and annexed crimea,"Crimea voted for secession and Russia accepted and annexed Crimea, what a crisis!"
paradetox,daesh and isis actually mean about the same thing and they dont give a fuck .,Daesh and Isis actually mean about the same thing,daesh and isis actually mean about the same thing and they don't care.
paradetox,"daniel pantaleo , the worthless bag of shit who got away with murdering eric garner .","daniel pantaleo , who got away with murdering eric garner .","daniel pantaleo , the person who got away with murdering eric garner ."
paradetox,"delta hasn 't always sucked , but this was one suck - ass move .",Delta is not always bad but this was his bad move,"Delta hasn 't always been bad, but this was one bad move."
paradetox,destined to repeat the same shit over and over again until we die .,destined to repeat the same thing over and over again until we die .,destined to repeat the same thing over and over again until we die.
paradetox,dg : youre correct that people have their donkey show moments when they do real stupid things .,"Really.,people usually behave strangely!",DG : you're correct that people have their moments when they do real bad things.
paradetox,did he come from poverty and bust his ass to buy the land ? doubtful .,Did he come from poverty and work hard to buy the land ? doubtful .,Did he come from poverty and work hard to buy the land ? Doubtful.
paradetox,did you think i was going to sit back and let some imbecile spew hatred towards me ?,Did you think I was going to let an unreasonable person hate me?,Did you think I was going to sit back and let someone say bad things towards me?
paradetox,DIGIT are you suggesting that should be enough to keep these uppity blacks satisfied ?,DIGIT are you suggesting that should be enough to keep these people satisfied ?,Are you suggesting that should be enough to keep these people satisfied?
paradetox,"DIGIT year olds can be little shits too , doesn t mean you fight them .","DIGIT year olds can be annoying too , doesn t mean you fight them","DIGIT year olds can be mischievous too, doesn't mean you fight them."
paradetox,DIGIT years later and they still blame bush for his fuck ups .,"Digit years later ,the still blame bush for his mistakes",Years later and they still blame bush for his mistakes.
paradetox,dmvs are un fucking believable .,dmvs are unbelievable,DMVs are unbelievable.
paradetox,do people actually believe this shit ? ? ?,Is there people who believe in this?,Do people actually believe this? ? ?
paradetox,do people really think everyone is too dumb to recognize this double standard ?,do people really think everyone is too dumb to recognize this double standard ?,Do people really think everyone is too unaware to recognize this double standard ?
paradetox,do you ever get tired of asking stupid questions ?,Are you tired of asking questions?,Do you ever get tired of asking irrelevant questions?
paradetox,does this shit happen there every year ? .,does this occurrence happen there every year ? .,Does this happen there every year?
paradetox,doesn t this shit happen all the time ? .,Doesn't thia happen all the time?,Doesn't this happen all the time?
paradetox,don 't touch the shit thats really close by,Don't touch the thing that's really close by,Don't touch the stuff that's really close by.
paradetox,"don t be such a nitpicky cunt , it s bad for .","Don't be stubborn, it's bad for","Don't be so nitpicky, it's not good."
paradetox,dont be a dick and add stupid and clear vandalism to articles .,Do not be like that and add clear vandalism to the article.,Please don't add inappropriate and clear vandalism to articles.
paradetox,dont cut off your nose to spite your face .,Don't annoy me,Don't take drastic measures that could backfire.
paradetox,dont give us that crap about out of towners coming here and dropping bucketsey either .,dont give us that story about out of towners coming here and dropping bucketsey either,Don't give us that story about out of towners coming here and making messes either.
paradetox,dont have time for these assholes .,dont have time for these guys,don't have time for these people.
paradetox,"dont you ever change one of my edits , or i will come to your house , and i will cut you .",Be appreciative and considered my edits.,"Don't change one of my edits, or else I will take action."
paradetox,"dopey comment of the week , congrats",I do not agree with this comment of the week,"Unwise comment of the week, congrats"
paradetox,"economies of iran , venezuela , iraq , etc still shit .","economies of iran , venezuela , iraq , etc still conflict","Economies of Iran, Venezuela, Iraq, etc still not good."
paradetox,eh this seems to be reasonable since their crazy as fuck neighbor keeps launching missiles into the sea .,This seems reasonable since their neighbor is crazy.,Eh this seems reasonable since their neighbor keeps launching missiles into the sea.
paradetox,"either he had one heck of defence team , or prosecutor really fucked up .",Either he had a great defense team or the prosecutor did not do a good job.,"either he had one great defence team , or prosecutor really made a mistake ."
paradetox,"either way , how the fuck do you forget your child in the backseat .","Either way, how could you forget your child in the backseat?","either way, how do you forget your child in the backseat."
paradetox,either way you sound foolish and ill informed .,I'm a well informed person,Either way you sound misinformed and uninformed.
paradetox,eli5 why should governments give a fuck ? .,Why should governments care ?,Explain why should governments care?
paradetox,even bush knows he fucked up .,Bush is well aware that he has messed up,even bush knows he made mistakes.
paradetox,everybody is such a fucking pussy .,Everybody is not good.,Everybody is so timid.
paradetox,everyone s got that single issue that represents the burr up their ass .,everyone has their own single issue.,Everyone has that single issue that represents the difficulty they are facing.
paradetox,"except for , ya know , that stock market crash that literally just fucking happened .","except for , ya know , that stock market crash that literally just happened .","Except for, ya know, that stock market crash that recently happened."
paradetox,"except your bankers , lobbyists , crappy congressmen women , nsa , big corp and your expensive as fuck healthcare .","except your bankers , lobbyists , congressmen women , nsa , big corp and your expensive healthcare","except your bankers, lobbyists, congresspeople, NSA, big corporations and your expensive healthcare."
paradetox,"fdr shit all over the constitution , but he s still regarded as a very good president .","FDR is all over the constitution, but he is still regarded as a very good president","FDR disregarded the constitution, but he is still regarded as a very good president."
paradetox,"food is really fucking cheap , jail time because people robbed stores rather than starve to death is not .",food is really cheap now so it's not an option to rob a store rather and go to jail than starve to death,"Food is relatively inexpensive, whereas jail time for people who rob stores rather than starve to death is not."
paradetox,"for $ DIGIT , who gives a shit .","For the amount, one does not care.","for $ DIGIT, who cares."
paradetox,for those without health insurance in fuck up states that didn 't expand medicaid .,For those without health insurance in states that didn't expand medicaid,for those without health insurance in states that didn 't expand medicaid.
paradetox,fox news is going to shit themselves when they hear this .,fox news is going to be afraid when they hear this .,Fox news is going to be shocked when they hear this.
paradetox,"from personal experience , waspy white kids get away with shit no minority could at least in utah .","from personal experience , white kids get away with crime no minority could at least in utah","From personal experience, white kids get away with things no minority could at least in Utah."
paradetox,"fuck , i have to change my whole outlook .","OH , I have to change my whole outlook",I have to change my whole outlook.
paradetox,fuck alcohol and anyone who drives while drinking the stuff .,Away with alcohol and anyone driving while drinking it,Disapprove of alcohol and anyone who drives while drinking the stuff.
paradetox,fuck ever doing that again .,Don't think of doing that again,never doing that again .
paradetox,"fuck it , we 'll do it live .","Never mind, we 'll do it live",Let's do it live.
paradetox,fuck it i ll just click the first name so i can go home .,never mind i will just click on the first name so i can go home,I'll just click the first name so I can go home.
paradetox,"fuck me , even afghanistan has number .","Shockingly , even Afghanistan has number .","Wow, even Afghanistan has numbers."
paradetox,"fuck minimum security , put him in real prison .",Put him in real prison,Put him in a more secure prison.
paradetox,fuck off - it is international airspace,Please leave this inernational airspace,Leave - it is international airspace.
paradetox,fuck popeyes for doing this in the first place .,popeyes should not have done this in the first place,Disapprove of Popeyes for doing this in the first place.
paradetox,fuck red light cameras and the money grubbing cities that use them .,I dont care about red light cameras and the cities that use them,Disapprove of red light cameras and the money grubbing cities that use them.
paradetox,"fuck them and all their pussy , shitty , fucking rules .",I don't care about rules.,Disregard all their rules.
paradetox,fuck this scumbag piece of shit and all his political cohorts .,I don't care about the politician,Dislike this person and all his political cohorts.
paradetox,"fuck you , i wont do what you tell me .","Sorry, but I won't do what you say.",I won't do what you tell me.
paradetox,"fuckin sonofabitch , where are you from ?",Where are you from?,Where are you from?
paradetox,fucking barbarian gooks got a lot of nerve to mess with us .,Barbian hooks has a lot of intention to deal with us.,They have a lot of nerve to challenge us.
paradetox,fucking cunt of a person .,A bad person.,Terrible person.
paradetox,"fucking isis , had to go and put a little blemish on archer didn t they .",Isis had to go and put a littke blemish on anrcger didn't they?,"ISIS had to go and put a little blemish on Archer, didn't they."
