source,sentence,paraphrase,result
paradetox,this populist crap is just the psych majors manipulating you .,The talk on populism is manipulated by,This populist rhetoric is just the psych majors trying to influence you.
paradetox,this shit has been happening for generations .,Its something that has been there in decades,This has been happening for generations.
paradetox,this shit has gone full circle from parody .,This has gone full circle from parody,This has gone full circle from parody.
paradetox,this shit is overwhelming to think about .,This mess is too much to think about.,This is overwhelming to think about.
paradetox,this sick fuck is just a sociopath who doesn t want to face the consequences for his actions .,He doesn t want to face the consequences for his actions .,This person is a sociopath who doesn't want to face the consequences for his actions.
paradetox,this whole place is fucking corrupt .,The whole place us corrupt,This whole place is corrupt.
paradetox,"those are truly repugnant , and there plenty out there on both sides on the idiotdriven social networks .",Those are truly repugnant and there plenty out there on both sides on social networks.,"those are truly unpleasant, and there are plenty out there on both sides on the naive-driven social networks."
paradetox,those things are complete and utter pieces of shit .,I would not buy it.,Those things are completely useless.
paradetox,"throwing his ass in jail is the best thing possible , since it protects others from his willful drunk driving .","Locking him in the jail is the best thing possible, since it protects others from his willful drunk driving.","putting him in jail is the best thing possible , since it protects others from his reckless drunk driving ."
paradetox,time to cut the credits and also cut the crap .,It's time to cut the credits and also the expense.,time to cut the credits and also stop this.
paradetox,time to wage war and blow shit up .,Time to wage war and fly to infinity.,Time to wage war and cause destruction.
paradetox,to suggest otherwise is stupidly inflammatory .,To suggest otherwise will hurt.,to suggest otherwise is recklessly inflammatory.
paradetox,to think that she 's been doing that kind of shit for yeaaaars,To think she's been doing that for years.,to think that she 's been doing that for years
paradetox,"top ten most relevant "" are you fucking sorry ""","Top ten most relevant "" are you sorry?""","Top ten most relevant ""Are you sorry?"""
paradetox,treats their murder victims like garbage while living their life pretending they are normal .,Murderers are acting normal nowadays.,treats their murder victims disrespectfully while living their life pretending they are normal .
paradetox,"turkey could invade , and russia wouldn 't be able to do shit about that either .",Turkey could invade and Russia wouldn't be able to do anything about that either,"turkey could invade, and russia wouldn't be able to do anything about that either."
paradetox,"unless you are harvesting and grinding your own beans , you are fucked .","Unless you are harvesting and grinding your own beans, you are done for.","unless you are harvesting and grinding your own beans , you are not getting the best quality."
paradetox,use your own name to comment in public or i will be forced to call you a coward .,Be confident to evaluate your self,Use your own name to comment in public or I will have to refer to you as not courageous.
paradetox,"useful idiots ) of course , the russians are still at it thats what they do regards .","of course , the russians are still at it thats what they do regards","useful people ) of course , the russians are still at it thats what they do regards ."
paradetox,very few of these cophating clowns ever make cora requests for those case files .,A few of them ever make cora requests for those case files,Very few of these police-critical people ever make requests for those case files.
paradetox,"we 're not fucking worlds leaders in this bitch , all you 'll get is speculation .","we are not leaders in this, all you will get is speculation","we 're not world leaders in this, all you 'll get is speculation."
paradetox,we don t need to consider shit !,we don t need to consider!,we don't need to consider it!
paradetox,we dont need no stinking nevertrumpers up in here !,We do not need people against Trump here!,We don't need any nevertrumpers here.
paradetox,"we had to find some use for that damn lock box , sure as shit didn t put money in it .","we had to find some use for lock box , sure didn t put money in it .","We had to find some use for that lock box, certainly didn't put money in it."
paradetox,we rely on our government to protect us the military yet conservatives aren 't bitching about that .,We rely on our government to protect us the military yet conservatives aren't talking about that.,we rely on our government to protect us through the military yet conservatives aren't complaining about that.
paradetox,we should answer those ads and then sabotage the fuck out of the equipment .,we should answer those ads and the sabotage out of the equipment.,We should answer those ads and then sabotage the equipment.
paradetox,"we shouldn t be shitting on his good name , and saying what he should , and shouldn t have done .",we should not desecrate his name instead we should have done better.,"we shouldn't be criticizing his good name, and saying what he should, and shouldn't have done."
paradetox,"well , dunno about him being an asshole , but he was definitely a fucking moron .","well , dunno about him being not nice , but he was definitely not smart","Well, not sure about his character, but he was definitely not smart."
paradetox,"well , there ya go , miss cunt .","Well, here you go","Well, there you go."
paradetox,"well no fucking shit , i can t believe people are only starting to realise this .",I cant believe people realise this,"Well, I can't believe people are only starting to realise this."
paradetox,well they fucked up youtube hard .,Well they messed up YouTube,Well they messed up youtube badly.
paradetox,west is the spoiled shit .,west is bad.,The West is spoiled.
paradetox,"weve become too accepting of her nonsense , which fosters hate .",We have become too tolerant her actions which foster hate.,"We've become too tolerant of her ideas, which encourages hate."
paradetox,weve got one clown in the wh .,We've got one comedian in the wh,We have one person in the White House.
paradetox,what 's with these people coming on here and saying this shit ?,What's with these people coming on here and saying things?,What's with these people coming on here and saying this?
paradetox,what a bunch of sick lies !,That is a lot of lies!,What a bunch of untruths!
paradetox,what a fucking idiot you are .,you are naïve,You are not making the best decisions.
paradetox,what an arse hole you are !,What kind of a person you are!,What a bad person you are !
paradetox,what kind of really really stupid plan is that ?,What kind of plan is that?,What kind of plan is that ?
paradetox,what kind of shit did you put on my phone with that first link ? .,what kind of thing did you put on my phone with that first link?,What kind of thing did you put on my phone with that first link?
paradetox,what kind of shit post is this ? .,What kind of Post is this?,What kind of post is this?.
paradetox,what s the fucking point of wearing them ? .,what s the point of wearing them ?,What is the point of wearing them?
paradetox,what the actual fucking hell does it matter ?,What is the matter?,What does it matter?
paradetox,"what the fuck did you do to my free images like this one , , you lazy shit .",What did you do to my images like this one,"What did you do to my free images like this one, you lazy person."
paradetox,what the fuck do you mean cornered ? .,what do you mean by cornered,What do you mean cornered?
paradetox,what the fuck is this comment ? .,What is this comment?,What is this comment?
paradetox,what the fuck is this guy doing,What is this person doing,What is this guy doing?
paradetox,what the fuck is this news story ? .,what is the news story ?,What is this news story?
paradetox,what the fuck is wrong with australia ? .,What is going wrong with Australia,What is wrong with Australia?
paradetox,what the fuck is wrong with you ?,what is wrong with you?,What is wrong with you?
paradetox,what the fuck is wrong with you guys,What is wrong with you guys,What is wrong with you guys?
paradetox,what the heck is this about ?,What all of this about?,What is this about?
paradetox,what the hell is wrong with people .,what is wrong with people,What is wrong with people?
paradetox,what the hell question are you talking about ?,I have no idea which question you are talking about,What question are you talking about?
paradetox,whats really pathetic is how you jump to conclusions .,"whats really unrealistic, is how you jump to conclusions",Whats really unhelpful is how you jump to conclusions.
paradetox,"whats the title of this report , no shit ? .","whats the title of this report , nothing ?",What is the title of this report ? .
paradetox,when i was your age and starting to realize all this shit i became very depressed and it sucked .,"When I was your age and in the same situation, I became depressed and it was annoying",When I was your age and starting to realize all this stuff I became very sad and it was difficult.
paradetox,wheres dis schmuck get his degree from ?,wheres dis person get his degree from ?,Where did this person get their degree from?
paradetox,who really gives a crap about this ?,Who really care about this?,who really cares about this?
paradetox,who the fuck cares whose fault it is ?,Doesnt matter whose fault it is,who cares whose fault it is ?
paradetox,who the fuck is pushing diversity on you ? .,who is pushing for diversity?,Who is pushing diversity on you?
paradetox,who the hell do you feminists think you are anyway ?,Who do you feminist think you are anyway?,Who do you feminists think you are?
paradetox,why can 't they just fucking give the guy credit for voting no ?,why can 't they just  give the guy credit for voting no ?,Why can't they just give the guy credit for voting no?
paradetox,why do you guys do this shit out west ?,Why do you guys do this out of west?,Why do you guys do this out west?
paradetox,"why does it bother you , fuckface ?",Forget it,Why does it bother you?
paradetox,why is reddit so fucking biased ?,why is reddit so biased,why is reddit so biased ?
paradetox,why is the scale of that graphed so fucked up ? .,Why is that graphed's scale so messed up?,Why is the scale of that graphed so off?
paradetox,why not drop health insurance companies all together and get the government to stop hospitals from fucking price gouging ?,Why not stop health insurance companies all together and get the government to stop hospitals from hiking price,why not drop health insurance companies all together and get the government to stop hospitals from price gouging?
paradetox,why should i give a fuck !,Why should I border!,Why should I care?
paradetox,why the fuck did they give some ufo hack interview time ? .,why did they give some ufo hack interview time ? .,Why did they give some ufo hack interview time?
paradetox,why the fuck does everyone hate syria so much ? .,why does everyone hate syria so much,Why does everyone have such strong negative feelings towards Syria?
paradetox,why the fuck haven 't they condemned north korea ?,why haven 't they condemned north korea ?,why haven 't they condemned north korea ?
paradetox,wow . what the fuck where they thinking when they named that cleaning product . seriously . &gt . &lt,Wow. I don't think that is a good name for that cleaning product.,Wow. What were they thinking when they named that cleaning product. Seriously.
paradetox,wtf ? ? missouri needs to catch the fuck up like right now .,missouri needs to catch up like right now .,What? Missouri needs to catch up right now.
paradetox,wtf is this shit a self selected internet poll quoted as if it were a real statistic ? .,What a self selected internet poll quoted as if it were a real statistic ?,what is this a self selected internet poll quoted as if it were a real statistic?
paradetox,"yea , who the fuck is government to be involved my my your kids education ? .","yes, who is the government to be involved in my education of my children? .","Yes, who is government to be involved in my or your kids education?"
paradetox,"yeah , americans with quadruple citizenship so they have where to go in case shit gets serious anywhere else .","Yeah , Americans with quadruple citizenship so they have where to go in case things gets serious anywhere else .","yeah , americans with quadruple citizenship so they have somewhere to go in case things get difficult anywhere else ."
paradetox,"yeah , comparitively fuck all because they have loads of offshore hidden bank accounts and smart accountants ? .","yeah , comparatively because they have loads of offshore hidden bank accounts and smart accountants ? .","yeah , comparitively not much because they have loads of offshore hidden bank accounts and smart accountants ? ."
paradetox,yeah i hate this shit .,Yeah i hate this,"Yeah, I don't like this."
paradetox,yeah they don t give a fuck .,They don't give,"Yeah, they don't care."
paradetox,yeh well ban me fukkers fuck you morons,You can ban me.,"Well, ban me if you must."
paradetox,"yes , it does stink to high heaven but there are enough gullible fools who praise this outfit nonetheless .","Yes, it does sink to high heaven but there are enough naive persons who praise this outfit nonetheless.","yes , it does have a bad reputation but there are enough people who praise this outfit nonetheless ."
paradetox,yet fifa doesn t give two fucks .,yet fifa doesn't care.,Yet fifa doesn't care.
paradetox,yet to this day people still believe the bullshit lies about clinton .,yet people are still believing in rumours and lies about clinton.,yet to this day people still believe the false stories about clinton.
paradetox,yo buddy why are you saying mean shit to me ?,Yo buddy why are saying mean things to me?,yo buddy why are you saying hurtful things to me ?
paradetox,you 've lost your fucking chances .,You've lost your good chances,You have lost your chances.
paradetox,you are a bit of a dick,You are a bit intense,You are a bit rude.
paradetox,you are liable to break something and touch shit you shouldnt touch .,you are liable to break something and touch stuff you shouldn't touch.,You are likely to break something and touch things you shouldn't touch.
paradetox,you bunch of asshats pushing your agenda instead of being neutrel .,I think you should be neutrel and you should not push your agenda.,you bunch of people pushing your agenda instead of being neutral.
paradetox,you don 't remember that shit ?,Do you remember that incident?,You don't remember that?
paradetox,you have got to be insane .,Are you out of your mind?,you have got to be out of your mind.
paradetox,you have no fucking idea youtu .,You have no idea you too,You have no idea about YouTube.
paradetox,"you know more than these idiots , stay the course and the truth will prevail .",Just say the truth and it will set you free,"You know more than these people, stay the course and the facts will be revealed."
paradetox,you leave me alone asshole !,please leave me alone,Please stay away from me.
paradetox,you missed the fucked up sentence .,You missed the point.,you missed the problematic sentence.
paradetox,you trolls still wouldn t give a shit .,your actions still do not bother me.,you trolls still wouldn't care.
paradetox,"you ve got to be fucking kidding me , right ? .","You are kidding me , right?","You've got to be kidding me, right?"
paradetox,your types of examples are idiotic .,your type of example are not very smart,Your types of examples are misguided.
paradetox,"yup , keep government shit off air unless you want shit to get worse .",rather keep government issues off air or the situation might get worse.,"yup , keep government information off air unless you want things to get worse ."
paradetox,"yurope is fucking awesome that way , yeah s .","Europe is amazing that way, yeah","Europe is awesome that way, yeah."
APPDIA,So maybe you should be more retarded.,So maybe you should be more backward,So maybe you should be more slow.
APPDIA,THERES A MEGATHREAD FOR VACCINE OR COVID RELATED TOPICS. DON'T TALK ABOUT THAT SHIT HERE IDIOT!,THERES ACTUALLY A MEGATHREAD FOR VACCINE OR COVID RELATED TOPICS. DON'T TALK ABOUT THAT STUFF HERE!,THERES A MEGATHREAD FOR VACCINE OR COVID RELATED TOPICS. DON'T TALK ABOUT THAT HERE.
APPDIA,the fuck.... you are on drugs,uh..... you are not being realistic,the heck.... you are out of it
APPDIA,NTA.   Dump his ass. Tablemanners are no rocket science. Treating other people like human beings is no rocket science. His still a child.,You should leave him. Tablemanners are no rocket science. Treating other people like human beings is no rocket science. His still a child.,You are not at fault. Leave him. Table manners are not difficult to learn. Treating other people with respect is not difficult to learn. He is still a child.
APPDIA,Youre soft as baby shit,Youre really soft,You're very weak.
APPDIA,Because everyone knows why. It’s jadas fault. Will was just triggered because of all the shit he has to deal with because of her.,Because everyone knows it's jadas fault. Will was just triggered because of everything he has to deal with because of her.,Because everyone knows why. It’s jadas fault. Will was just upset because of all the difficulties he has to face because of her.
APPDIA,And “poor kids are just as bright as white kids”…. Your blundering bafoon chooses racism as well,"He said ""poor kids are just as bright as white kids"".",And “poor kids are just as bright as white kids”…. Your blundering bafoon chooses prejudice as well.
APPDIA,Tucker is a garbage person that no one will miss when he’s gone… he’s also a racist ruble-rouser,Tucker is a bad person who instigates racism,Tucker is a bad person that no one will miss when he’s gone… he’s also a person who stirs up racism.
APPDIA,"There’s plenty of evidence, it’s exactly why they won’t allow forensic audits   *wipes voting machines clean of their records*","There is evidence, which is why they won't allow forensic audits.","There’s plenty of evidence, it’s exactly why they won’t allow forensic audits   *erases voting machines of their records*"
APPDIA,"Came here to say this, carlsen is a freaking moron and defines recreational outrage imo","Came here to say this, carlsen is pretty unintelligent and defines recreational outrage imo",I agree that Carlson is misinformed and often causes unnecessary outrage.
APPDIA,Fuck off dude. Worst of  the fucking worst!,Stop dude. Worst of the worst!,Get out of here dude. Worst of the worst!
APPDIA,This is so cringe. What a fucking loser.,This is so cringe.,This is so awkward. What a person.
APPDIA,Trump deferred to the experts on COVID??  LMFAO   Christ this sub needs help,Trump deferred to the experts on COVID??  LMFAO  this sub is wild,"Trump deferred to the experts on COVID??  Wow, this sub needs help."
APPDIA,What the fuck is this supposed to mean?,What is this even supposed to mean?,What is this supposed to mean?
APPDIA,"Jesus fucking H Christ. Get a lawyer and a therapist, immediately. Holy fucking shit.","Oh my, you might want to get a lawyer and therapist immediately.","Jesus Christ. Get a lawyer and a therapist, immediately. Wow."
APPDIA,Less than no value-that’s cute coming from some pretentious douchebag that can’t comprehend reading comprehension lol.,Less than no value-that’s funny coming from you who can’t comprehend reading comprehension lol.,That's cute coming from someone who can't comprehend reading comprehension.
APPDIA,But but but what about this other guy. But but but this isn't fair. Whiny ass little babies,People are always what-abouting and complaining about it not being fair. They need to stop complaining,But but but what about this other guy. But but but this isn't fair. Complaining a lot
APPDIA,we're all damned so fuck it might as well have some fun along the way to social hell   \*grabs chainsaw\*,we're all damned so might as well have some fun along the way,"We're all doomed, so we might as well have some fun along the way."
APPDIA,Have you ever had salt water? It’s fucking gross.,Have you ever had salt water? It’s gross.,Have you ever had salt water? It’s unpleasant.
APPDIA,"Good. Stop fucking indoctrinating kids. Let them worry about tee ball and shit, not your ceaseless victimhood","Good, we should stop indoctrinating kids and let them worry about tee ball and kid stuff.",Good. Stop indoctrinating kids. Let them focus on activities like tee ball instead of your ceaseless victimhood.
APPDIA,>Stop being a weasel.  Address what I actually wrote or fuck off.,>Stop.  Address what I actually wrote please.,Stop avoiding the issue. Address what I actually wrote or leave.
APPDIA,So we can handle a lot of shit,So we can handle a lot of things,So we can handle a lot of stuff
APPDIA,"I bet you make stupid ass assumptions, then feel smug.","I bet you make ridiculous assumptions, then feel smug.","I bet you make incorrect assumptions, then feel smug."
APPDIA,The tree looks thirstier every damn day.,The tree looks thirstier every day.,The tree looks more and more dehydrated every day.
APPDIA,You are a special kind of idiot.,You are not very smart.,You are a unique individual.
APPDIA,Ya daughter is getting tricked out by Greek Nerds at UNC 🤣💯 NOW i’m a troll. Just so u know what it looks like,Your daughter might be getting tricked by members of Greek life at UNC.,Ya daughter is getting tricked out by Greek Nerds at UNC 🤣💯 NOW i’m being mischievous. Just so u know what it looks like
APPDIA,Really bad stance. What an unbelievable moron you are.,This is a really bad stance.,Really bad stance. What an unbelievable lack of understanding you have.
APPDIA,"Wow, you're a heartless piece of shit..","Wow, you're really heartless","Wow, you're really lacking in compassion.."
APPDIA,dude your takes are hot shit retarded,dude your takes are completely backward,dude your takes are really bad
APPDIA,The need to feel superior to others is by far the ugliest human trait. You are very very ugly. Eat dicks sizzle tits.,The need to feel superior to others is by far the worst human trait. It seems like you have that need.,The need to feel superior to others is by far the least attractive human trait. You are not very attractive.
APPDIA,Jaysus I knew you were far left. Goddamn I really hate discussing with people like you. So much more than far right. Bye.,I knew you were far left. I really don't like discussing with people like that. So much more than far right. Bye.,I knew you were far left. I don't enjoy discussing with people like you. Bye.
APPDIA,Just like Republicans creating themselves narratives to fuel their persecution complex to justify their hatred for everyone that isn't on the Jesus cock.,Just like Republicans creating themselves narratives as fuel to justify their hatred for everyone that isn't on their side.,Just like Republicans creating narratives to fuel their sense of persecution to justify their dislike for everyone that isn't on the same side.
APPDIA,Lame ass liberal Antifa and Fraudchi style smear. I hope you are woke enough to see what you have coming before it hits you.,This is a weak smear campaign. I hope you realize this.,Lame liberal Antifa and Fraudchi style smear. I hope you are aware of what is coming before it hits you.
APPDIA,I get it. This is evil. I don't know what to else to do.,I get it. I don't know what else to do.,I understand. This is wrong. I don't know what else to do.
APPDIA,answer:  technology ↗️ people (skill and just in general)↘️   people are dumb do we really need them on faster vehicles?,answer: technology ↗️ people (skill and just in general)↘️ people are incapable do we really need them on faster vehicles?,answer:  technology ↗️ people (skill and just in general)↘️   people are not as intelligent do we really need them on faster vehicles?
APPDIA,Go look at my posts and comments. Nothing is stopping you. Except I'm not a Democrat BECAUSE I am a Marxist.,Go look at my posts and comments. Nothing is stopping you. Except I'm not a Democrat BECAUSE I actually am a Marxist.,"Go look at my posts and comments. Nothing is stopping you. I am a Marxist, not a Democrat."
APPDIA,"In stupid places in the US, yes.  What is that supposed to prove?","In some places in the US, yes.  What is that supposed to prove?","In some places in the US, yes.  What is that supposed to demonstrate?"
APPDIA,"Oh now guys don't downvote old Lone Tooth, he is a war hero!!",Oh now guys don't downvote old Lone Tooth!!,"Oh now don't downvote old Lone Tooth, he is a war hero!!"
APPDIA,Bob for president! Stop apologizing to the sodomites!,Bob for president! Stop apologizing to them!,Vote for Bob! Stop apologizing to the LGBTQ+ community!
APPDIA,Dem sponsored invasion.  Stay strapped my friends. Shits going to get rough real soon,Dem sponsored invasion.  Stay woke my friends. Its going to get rough real soon,Politically sponsored invasion.  Stay prepared my friends. Things are going to get difficult soon.
APPDIA,"As mentioned, he threw a plastic bag at him. Apparently in America that gives you the right to murder that person.","As mentioned, he threw a plastic bag at him. Apparently in America that gives you the right to harm that person.","As mentioned, he threw a plastic bag at him. Apparently in America that gives you the right to use force against that person."
APPDIA,OP is a special kind of stupid,OP is especially not smart,OP is a special kind of misinformed
