source,sentence,paraphrase,result
paradetox,"seriously , at least number people are dead leave aside your point scoring and generally just fuck off .","seriously, at least number people are dead so just keep quiet","Seriously, at least a certain number of people are dead, so please stop trying to score points and just go away."
paradetox,seriously why do first world countries accept third world immigrants who have turned their own countries into shit ? .,seriously why do first world countries accept third world immigrants who have turned their own countries?,seriously why do first world countries accept third world immigrants who have caused their own countries to decline?
paradetox,she fucking lied to them about what she was doing .,she  lied to them about what she was doing .,She lied to them about what she was doing.
paradetox,she is a massive porn star whos vagina and arse split to create one big gaping whole .,she is an excellent adult movie actress,She is a massive porn star with a large opening.
paradetox,"shit , china can get own this if they want to .",China can get this if they want to.,"wow, china can get own this if they want to ."
paradetox,"shit , i d love an number pm sunset .",i d love an number pm sunset .,I would love a late afternoon sunset.
paradetox,"shit , they even do it in their own country .",They do it with their own country.,"Wow, they even do it in their own country."
paradetox,shit . i might have it,I might have it,I might have it.
paradetox,"shit boris we re supposed to be in kiev , not london !","What happened Boris we are supposed to be in Kiev, not in London!","Boris, we were supposed to be in Kiev, not London!"
paradetox,shit just got real upload .,Things just got real.,things just got real upload.
paradetox,"shit looked like a music video with synced audio , and footage editing .","looked like a music video with synced audio , and footage editing .",It looked like a music video with synced audio and footage editing.
paradetox,shit we are losing our ability to compete globally .,We shouldn't lose our ability too compete globally,We are losing our ability to compete globally.
paradetox,"side - note , why the fuck does everything the us make have to be called "" joint . """,Side note why the us make have to be called joint,"side - note , why does everything the us make have to be called "" joint . """
paradetox,"silicon valley resident here , this is so fucked up .","silicon valley resident here , this is so messed up .","Silicon Valley resident here, this is so messed up."
paradetox,"silly you , its not about making america safe or the reevaluation .",I'ts not about making america safe or the reevaluation.,It's not about making America safe or the reevaluation.
paradetox,sit on your ass at home and don t vote at your peril .,Sit at home and relax and dont vote at your risk,stay at home and don't vote at your own risk.
paradetox,"smug , violent thug is more appropriate .",Corrupted man is more appropriate.,"Arrogant, aggressive person is more appropriate."
paradetox,"so , 'cctv shows' crimea parliament explosion with a shitty picture of fuck knows what with a bit of smoke in it .",So cctv shows Crimea parliament explosipm with a picture of God knows what with a bit of smoke in it,"So, 'CCTV shows' crimea parliament explosion with a poor picture of something with a bit of smoke in it."
paradetox,"so again , unless you have something useful to say , fuck off .","so again, unless you have something useful to say ,shut up","So again, unless you have something useful to say, please leave."
paradetox,"so i would really like it if people could stop acting like that 's why he got shot , it fucking isn 't .","so i would really like it if people could stop acting like that 's why he got shot , it isn 't .","So I would really like it if people could stop acting like that's why he got shot, it isn't."
paradetox,so is torture why should they give a shit ? .,Is torture the reason why they care?,So why should they care about torture?
paradetox,so shut the hell up until you know what it is your talking about .,so please be quiet until you know what it is your talking about,So be quiet until you know what it is you're talking about.
paradetox,so stop pointing your hypocritical fingers .,so stop pointing your guilty fingers,so stop pointing your accusing fingers .
paradetox,so they don 't give a flying fuck about long term effects .,So they don't care about long term effects,so they don 't give a care about long term effects .
paradetox,"so vw drops almost number in value after this shit , but gm still exists after killing hundreds of people ? .",Why is vw value down while gm is not affected even after killing hundreds of people?,"So VW drops almost number in value after this incident, but GM still exists after causing harm to hundreds of people?"
paradetox,some most of this fire was on balconies which dropped flaming shit onto others .,some most of this fire was on balconies which dropped flames onto others,some of this fire was on balconies which dropped flaming objects onto others .
paradetox,some poor guy robs a liquor store for $400 and goes to prison to get raped in the ass .,some poor guy robs a liquor store for $400 and goes to prison,Some poor guy robs a liquor store for $400 and goes to prison to be punished.
paradetox,"someone says no , and they say fuck off we need vets only for free housing ? .","someone says no , and they say we need vets only for free housing ? .","someone says no, and they say they need vets only for free housing?"
paradetox,spoiler russia doesn t give a fuck what canada thinks .,Russia don't like Canada.,Spoiler Russia doesn't care what Canada thinks.
paradetox,spouts nonsense about things he absolutely does not understand .,He commented on topics he did not hold knowledge of,Spouts words about things he does not understand.
paradetox,"still seems tame compared to r hurtinganimals wouldn t go there , even the thumbnails are fucked up .","Still seems tame compared to hurting animals. Wouldn't go there, even the the thumbnails are messed up.","Still seems mild compared to r hurtinganimals wouldn t go there, even the thumbnails are unpleasant."
paradetox,still standing up for your lying crazy leader who loves himself and nobody else .,Still standing up for your leader who loves himself and nobody else,still standing up for your leader who loves himself and nobody else.
paradetox,"stop being such a pussy , are you his mom or something ? .",Are you his mom or something?,"Stop being so timid, are you related to him or something?"
paradetox,straight people get married and fuck kids up all the time .,Straight people get married and it doesn't always make things better for kids,Straight people get married and mess up with kids all the time.
paradetox,"strong fiscal management , my ass , steve o .",I don't think it's strong fiscal management.,Steve O's fiscal management is not strong.
paradetox,stupid for a ball coach to make ten times what a teacher makes .,It doesn't make sense for a ball coach to make ten times what a teacher makes,It is unfair for a ball coach to make ten times what a teacher makes.
paradetox,"such a good fucking band , who 'll forever be tied to terrorism now simply because of their name .","Such a good  band , who 'll forever be tied to terrorism now simply because of their name .","Such a good band, who will now be associated with terrorism because of their name."
paradetox,sucked like nothings ever sucked before .,Nothing could be worse.,It was worse than anything before.
paradetox,"sure he should get punished , but three fucking years ? .",He should get punished surely but not for three years.,"Sure he should get punished, but three years ?"
paradetox,"take your inane , useless hypocrisy elsewhere , gessler .",we are not in the same page,"take your inane , useless attitude elsewhere , gessler ."
paradetox,take your own advice and go fuck off to one of these other subreddits .,I personally think that you should not bother me any longer,take your own advice and go to one of these other subreddits.
paradetox,taking a stand with either party is equally retarded .,Taking a stand with either party is not a good choice.,Taking a stand with either party is equally misguided.
paradetox,tha last fkn time bitchez !,It's the last time,That was the last time!
paradetox,thank god for the magical fuck frog .,Thank God for the miracle.,Thank god for the magical frog.
paradetox,that almost never happens excepts rarely in shit hole countries .,That almost never happens except rarely in some countries.,That almost never happens except rarely in certain countries.
paradetox,that and their shitty ass service .,that and their not so good service,that and their poor service.
paradetox,that crap has got to stop .,that has got to stop.,That has got to stop.
paradetox,that guy used to be a real dick .,That guy used to be a mean person,That guy used to be really annoying.
paradetox,that ignorant failure isnt qualified for any public office .,he is not qualified for any public  office i,that person is not qualified for any public office.
paradetox,that man is the biggest piece of shit in ny s recent history .,that man is the biggest issue in my recent history,That man is the least desirable in NY's recent history.
paradetox,that s a lot of work for something that shouldn t take any fucking work at all .,That is a lot of work for something that should not take any great work at all,That's a lot of work for something that shouldn't take any work at all.
paradetox,that s fucking murder in my book and they let parents off for that shit all of the time .,that is murder in my book and they let parents off for that all the time .,That is murder in my book and they let parents off for that all of the time.
paradetox,that s some pretty shit logic .,Didn't agree with the logic,That's some poor logic.
paradetox,that s the type of shit grand juries are supposed to avoid .,that's the type of things grand juries are supposed to avoid.,That's the type of situation grand juries are supposed to avoid.
paradetox,that s what they all say till their ass is cooking in radiation .,that is what they say till the situation changes for the worse.,that s what they all say till they are in danger of radiation.
paradetox,"that said , i hope they get a great attorney and sue the shit out of the cops .","that said , i hope they get a great attorney and sue the cops .","That said , i hope they get a great attorney and sue the cops ."
paradetox,that scum is smiling in court !,That good for nothing is smiling in the court !,He is smiling in court!
paradetox,that shit is nasty on your lungs .,that thing is disgusting on your lungs,That is unpleasant on your lungs.
paradetox,that shit is way stronger than the heroine i just shot up with .,that thing is way stronger than the heroine i just shot up with .,That is way stronger than the heroine I just injected.
paradetox,that sounds democratic as fuck .,That sounds very democratic.,That sounds democratic.
paradetox,that stupid water pipe is just a fatal accident waiting to happen .,That water pipe is Just an accident waiting to happen.,That water pipe is a potential accident waiting to happen.
paradetox,"that why it is stupid , it does not truly reflect the views of the people .",That does not reflect the view of the people sentiments,"That is why it is not accurate, it does not truly reflect the views of the people."
paradetox,thats a great fucking point .,That's a great point,That's a great point.
paradetox,thats an asinine racist comment .,thats an racist comment .,That's an offensive comment.
paradetox,"thats just stupid , how can i be blocked for stating a fact .","That's just unreasonable, how can I be blocked for stating a fact.","That's not fair, how can I be blocked for stating a fact?"
paradetox,"the "" joke "" that canada 's military is a joke is extremely played out , shit 's not funny .",the joke that Canada's military is a joke is  not funny.,The idea that Canada's military is a joke is overused and not funny.
paradetox,the claim that we can rely on the columbia river ( usa ) dams capacity is foolish .,the claim that we can rely on the columbia river (usa) dams capacity is not smart.,the claim that we can rely on the columbia river ( usa ) dams capacity is not reliable.
paradetox,the fact we are doing this now and it started when i was number number is fucking insane !,the fact we are doing this now and it started when i was number number is crazy insane !,The fact we are doing this now and it started when I was number is really incredible!
paradetox,the fuck am i reading so early ? .,i am reading early,What am I reading so early ?
paradetox,the germans today are the same blind brainless followtheleader sheep they were inand throughout their history .,the germans are the same they were in and throughout their history,"The Germans today are still following the same leader without thinking for themselves, as they have throughout their history."
paradetox,the guy was a sick fuck .,the guy was a mess.,The guy was not well.
paradetox,the guy was fucking shot ! .,That was really a good guy!,The guy was shot.
paradetox,"the image of an elephant crying , not just whimpering , but shedding tears , is fucking heartbreaking .","the image of an elephant crying , is heartbreaking .","The image of an elephant crying, not just whimpering, but shedding tears, is heartbreaking."
paradetox,the important things who the fuck has time to build chairs ? .,the important things who has time to build chairs? .,"The important things, who has time to build chairs?"
paradetox,"the judge was basically right , fuck your pitchforks .",Judge was right,"The judge was correct, disregard your pitchforks."
paradetox,the moment they hauled my ass in i would have played it for them .,The moment they hauled me in i would have played it for them,the moment they brought me in i would have played it for them.
paradetox,the object is to waste peoples time deconstructing your foolish effusions .,the aim is to waste people's time by deconstructing their effusions.,The object is to not waste peoples time deconstructing your ideas.
paradetox,the only respect he has is because he has access to the bomb codesand because he is a fool .,the only respect he has is because he has access to the bomb codesand,The only respect he has is because he has access to the bomb codes and because he is unsuitable.
paradetox,"the original surface was shit , but the new pro model is a quality enterprise tablet .","the original surface was bad , but the new pro model is a quality enterprise tablet .","The original surface was not good, but the new pro model is a quality enterprise tablet."
paradetox,the pay is shit and the hours are long .,The pay is menial and the hours are long,the pay is low and the hours are long.
paradetox,the people are still driving around in cars built on the fucking <number> 's .,The people are still driving around in cars built on the  <number>'s.,The people are still driving around in cars built in the <number>'s.
paradetox,the people who drafted this are probably privately the most fucked up of all .,the people who drafted this are probable privately the most affected of all.,The people who drafted this are probably the most misguided of all.
paradetox,the person was a piece of shit to begin with .,The person did not have a good attitude to begin with.,The person was not good to begin with.
paradetox,the point is that either choice was shit .,the point is that either choice was bad,the point is that either choice was not ideal.
paradetox,the really sad fucking part is they tried this story before in number maannews .,The sad part is they tried this story before in number,The really sad part is they tried this story before in number maannews.
paradetox,"the rewritten rules are stupidly insane , and any support of them follows suit .","The rewritten rules are insane, and any support of them follows suit.","The rewritten rules are bad, and any support of them follows suit."
paradetox,the shit in san bernardino was an office dispute that turned really ugly .,The problem in San Bernardino started as an office dispute,The situation in san bernardino was an office dispute that turned really bad.
paradetox,the stupid is if the pco thinks they can win by denigrating wynee and not offering a positive viable alternative .,the wrong thing is if the pco thinks they can win by deningrating wynee and not offering a positive viable alternative.,the problem is if the pco thinks they can win by criticizing wynee and not offering a positive viable alternative .
paradetox,the who can t do shit but try to educate people .,the who can t do anything but try to educate people,The who can't do anything but try to inform people.
paradetox,"the woman s a bitch , but the man s a psychopath .","the woman is not good, but the man is not normal.","The woman is not good, but the man is a psychopath."
paradetox,their shit is cheap but its of such awful quality that you re better off getting the more expensive item .,their product is cheap but its of such awful quality that you re better off getting the more expensive item .,Their items are cheap but its of such poor quality that you're better off getting the more expensive item.
paradetox,"then all of a sudden i see her , shes now got the big phony tits and everything .","All of a sudden i see her, she is all grown up.","then all of a sudden i see her , shes now got the bigger breasts and everything ."
paradetox,then drench the fucking thing with bbq sauce !,French it with BBQ sauce.,then drench the thing with bbq sauce !
paradetox,these idiots are bound and determined to start a civil war !,these people are bound and determined,These people are determined to start a civil war !
paradetox,these jerks have always been around .,These guys were always around.,These people have always been around.
paradetox,they 're living streaming on bbc for fucks sake .,They re living streaming on BBC for sake,They're live streaming on BBC.
paradetox,they are always puffing him up and blowing smoke up his butt and aggrandizing him and his fewaccomplishments .,the are always puffing him up and blowing smoke on him and aggrandizing him and his few accomplishments.,They are always praising him and his few accomplishments.
paradetox,they are smart for rejecting our shitty ass corn .,They are smart for rejectinf our corn.,They are wise for rejecting our corn.
paradetox,they are two faced fucks .,they are two face,They are two faced people.
paradetox,they deal with them and then they think everyone in society is a shit stain .,They deal with them and then they thing everyone in society is a stain,They deal with them and then they think everyone in society is a bad person.
paradetox,they don t give a shit about terrorism .,They don’t care about terrorism at all.,They don't care about terrorism.
paradetox,they get attention which is exactly what you fuck wits are giving them .,They get attention which exactly what you are giving them,They get attention which is exactly what they are receiving.
paradetox,"they have all the fucking money , how am i supposed to earn my billions ? .",how am i to earn when they own all the money?,"They have all the money, how am I supposed to earn my billions?"
paradetox,they have been involved in so many fucked up things since its creation .,They have been involved in so many not so good things since it's creation.,They have been involved in so many wrong things since its creation.
paradetox,they ll say and do anything to cover their asses won t they ? .,they says anything to clear themselves,they ll say and do anything to cover their tracks won t they ?
paradetox,they must have been pretty stupid to get caught in today environment .,They may get caught in today environment,They must have been pretty careless to get caught in today's environment.
paradetox,they named that shit after him .,They named that thing after him.,They named that after him.
paradetox,they need stop tratening people like morons .,They need to stop mistreating people.,they need to stop threatening people.
paradetox,they re a tinfoil wearing publication owned by a fucking cult led by a known tax evader .,they're a publication owned by a known tax evader.,They are a publication owned by a cult led by a known tax evader.
paradetox,they re both fucked up .,they are both in trouble,They are both messed up.
paradetox,"they really don t fit in , since they are just fucking immature assholes .",They are not mature enough to fit in.,"they really don't fit in, since they are just immature people."
paradetox,"they should have fled , i feel that these guys are fucked , who turns themselves in to an angry mob ? .","They should have escaped, i feel that these are are done, who turns themselves in to an angry mob","they should have left, I feel that these people are in a difficult situation, who turns themselves in to an angry group?"
paradetox,"they ve done that shit for so many years , especially when the large famine hit during the mid number s .","They have done that for so many years, especially when the large famine hit during the mid numbers","They've done that for so many years, especially when the large famine hit during the mid-2000s."
paradetox,they were most likely bought out by the fucking koch brothers .,They were most likely bought out by their brothers.,They were most likely bought out by the Koch brothers.
paradetox,they weren t suicide bombing for shits and giggles certainly .,they weren t self destruction bombarding for poops and snickers absolutely .,They weren't suicide bombing for amusement certainly.
paradetox,they will end up in hell !,They will face very high consequences,They will face consequences.
paradetox,they will find someone as retarded as him to become the glorious leader .,They will find someone unsuitable to become the leader.,they will find someone as unsuitable as him to become the leader.
paradetox,this administrations shit stinks as bad as the last ! .,this administration is as bad as the last!.,This administration is as bad as the last one!
paradetox,this article so many of the comments suck .,The comments section of the article isn't good.,This article and many of the comments are not good.
paradetox,this deadly behavior is why abusive police in the 60s were referred to as pigs .,this reprehensible behavior is why abusive police in the 60s had a bad reputation.,This deadly behavior is why abusive police in the 60s were referred to negatively.
paradetox,this guy is a total sellout with no brains for business and lacks the ability of forward thinking .,This guys have no idea of business and lavks ability of forward thinking,This guy is a sellout with no business acumen and lacks the ability of forward thinking.
paradetox,this has to be the dumbest editorial of all time .,I do not enjoy this editorial.,this has to be one of the worst editorials of all time.
paradetox,this is a fuckingtzu tactic for shits sake .,that's a bad tactic,This is a tzu tactic for shits sake.
paradetox,"this is a joke , are you all fucking retards ? .",this is a joke why dont you understand?,"this is a joke , are you all not understanding ? ."
paradetox,"this is a special needs child with autism , not some angry little shit with no self control .",This child needs to be given special attention.,"This is a special needs child with autism, not someone with no self control."
paradetox,this is nothing short of a hateful whine by sore loser who didnt get her way .,This is nothing but short of detestable outcry by someone who didn't get her way,This is nothing short of a complaint by someone who didn't get what they wanted.
paradetox,this is possibly the most ignorant and oversimplified thing i have ever read .,I think you are wrong,this is possibly the most uninformed and oversimplified thing I have ever read.
paradetox,"this is ridiculous , all pain meds should be otc","This is unacceptable, all pain medication should be over the counter","This is unreasonable, all pain meds should be available over the counter."
paradetox,this is scaring the shit out of me .,This is scaring me,This is scaring me.
paradetox,this is some clockwork orange level shit .,this is some clockwork orange level thing,This is some clockwork Orange level thing.
paradetox,this is some twilight zone shit,This is some twilight zone stuff,This is some Twilight Zone level.
paradetox,this is the exact reason most people think the environmentalists are crazy !,This is the exact reason most people think the environmentalists are overreacting.,this is the reason why most people think the environmentalists are crazy!
paradetox,"this is the exact reason we need a national death penalty , his sentence should have been a short rope !",We need a national deTh penalty is a short rope.,"This is the exact reason we need a national death penalty, his sentence should have been severe."
paradetox,this is what happens when you gather a bunch of illiterate ignorant fucks and brainwash them with bs and propaganda .,Propaganda and blindly following political agenda of others can have dire consequences.,This is what happens when you gather a bunch of people who are not knowledgeable and brainwash them with false information and propaganda.
paradetox,this is why the country is fucked up .,That's why this country is in such a mess.,This is why the country is in a bad state.
paradetox,this isn t about agreeing on blowing shit up .,this isn't about agreeing on blowing suff up.,This isn't about agreeing on using violence.
paradetox,this junk talk is tiresome .,This talk is tiring .,This talk is tiresome.
paradetox,this piece of human garbage should rot in jail .,Criminals must be thrown in jail.,This person should stay in jail.
